<?xml version='1.0' encoding='UTF-8'?>
<!ELEMENT brands (brand)*>
<!ELEMENT brand EMPTY>
<!ATTLIST brand
    id CDATA #IMPLIED
    name CDATA #IMPLIED
  >
